{
  "mode": "forecasting",
  "universe": ["SPY", "TLT", "GLD"],
  "target": "excess_return",
  "horizon": "20d",
  "frequency": "daily",
  "cutoff": "2026-09-26",
  "output_level": "research_grade",
  "costs": {"transaction_cost_bps": 10},
  "constraints": {"max_turnover": 0.25, "max_drawdown": 0.20},
  "risk_measure": "cvar",
  "confidence_level": 0.95,
  "evaluation": {"method": "expanding_window", "train_period": 756, "validation_period": 126, "test_period": 252},
  "models": {
    "baselines": ["historical_mean", "arma_garch"],
    "challengers": ["lstm", "transformer", "ensemble"],
    "selection": {
      "primary_metric": "mae",
      "calibration_metric": "coverage",
      "economic_metric": "net_cvar_adjusted_return",
      "stability_metric": "regime_seed_window_score",
      "regime_slices": ["low_vol", "high_vol", "drawdown"],
      "seed_count": 3,
      "window_sensitivity_metric": "rolling_score_iqr",
      "feature_ablation_required": true,
      "benchmark_required": true,
      "criteria": {
        "statistical_validity": 0.20,
        "predictive_performance": 0.30,
        "economic_effectiveness": 0.25,
        "regime_stability": 0.15,
        "seed_window_sensitivity": 0.10
      }
    }
  },
  "feature_label_contract": {
    "availability_time_field": "availability_time",
    "purge_period": 20,
    "embargo_period": 5,
    "lineage_format": "column_path",
    "features": [
      {"feature_id": "lagged_return_5d", "formula": "log_return[t-4:t]", "source_ids": ["official_exchange"], "observation_time": "t", "availability_time": "close_timestamp", "forecast_origin": "next_open_timestamp", "label_horizon": "20d", "purge_required": true, "embargo_required": true, "point_in_time_safe": true, "name": "lagged_return_5d", "source_id": "official_exchange", "transform": "lag(return, 5)", "fit_scope": "point_in_time_raw", "lineage": ["prices.close", "prices.observation_date"]},
      {"feature_id": "realized_vol_20d", "formula": "std(log_return[t-19:t])", "source_ids": ["official_exchange"], "observation_time": "t", "availability_time": "close_timestamp", "forecast_origin": "next_open_timestamp", "label_horizon": "20d", "purge_required": true, "embargo_required": true, "point_in_time_safe": true, "name": "realized_vol_20d", "source_id": "official_exchange", "transform": "rolling_std(return, 20)", "fit_scope": "training_window", "lineage": ["prices.close", "prices.observation_date"]}
    ],
    "labels": [
      {"label_id": "excess_return_20d", "formula": "sum(log_return[t+1:t+20])-risk_free[t+1:t+20]", "source_ids": ["official_exchange", "risk_free"], "observation_time": "t", "availability_time": "label_end_close_timestamp", "forecast_origin": "next_open_timestamp", "label_horizon": "20d", "purge_required": true, "embargo_required": true, "point_in_time_safe": true, "name": "excess_return_20d", "target": "excess_return", "horizon": "20d", "label_start": "t+1", "label_end": "t+20", "overlap_group": "20d_forward_return", "lineage": ["prices.close", "risk_free.rate"]}
    ]
  },
  "preflight": {"require_manifest": true, "require_dataset": false, "require_reconciliation": false},
  "online": {"enabled": false, "provider_registry": ["fred", "alfred", "sec_edgar", "ecb_sdmx", "bis_sdmx"], "cache_dir": "artifacts/cache", "snapshot_dir": "artifacts/snapshots", "max_staleness_minutes": 1440, "allow_stale_cache": false, "require_raw_response": true, "revision_policy": "vintage_aware"},
  "refresh_policy": {"prices": "intraday", "macro_data": "on_release", "features": "daily", "forecast": "daily", "retrain": "weekly", "full_research": "monthly"},
  "output": {
    "artifact_dir": "artifacts",
    "analysis_json": "analysis.json",
    "html_file": "financial_research_brief.html",
    "decision_table_csv": "decision_table.csv",
    "decision_table_md": "decision_table.md"
  },
  "source_policy": {
    "price_abs_tolerance": 0.00000001,
    "price_rel_tolerance": 0.0001,
    "volume_abs_tolerance": 1,
    "volume_rel_tolerance": 0.005,
    "priority": ["official_exchange", "documented_api", "licensed_database", "public_aggregator"]
  }
}
